{
  "$schema": "https://json-schema.org/draft/2020-12/schema",
  "$id": "https://posselt.at/pf2e-kingmaker-tools/schemas/kingdom-activity.json",
  "title": "Kingdom Activity",
  "description": "A Kingdom Activity",
  "$ref": "#/$defs/Activity",
  "$defs": {
    "ActivityResult": {
      "type": "object",
      "additionalProperties": false,
      "required": [
        "msg"
      ],
      "properties": {
        "msg": {
          "type": "string"
        },
        "modifiers": {
          "type": "array",
          "items": {
            "$ref": "#/$defs/Modifier"
          }
        }
      }
    },
    "Activity": {
      "type": "object",
      "additionalProperties": false,
      "required": [
        "title",
        "description",
        "id",
        "dc",
        "skills",
        "phase",
        "enabled",
        "fortune",
        "oncePerRound"
      ],
      "properties": {
        "skills": {
          "$ref": "#/$defs/Skills"
        },
        "title": {
          "type": "string"
        },
        "description": {
          "type": "string"
        },
        "requirement": {
          "type": "string"
        },
        "special": {
          "type": "string"
        },
        "dc": {
          "anyOf": [
            {
              "type": "number"
            },
            {
              "type": "string",
              "enum": [
                "control",
                "custom",
                "none",
                "scouting"
              ]
            }
          ]
        },
        "phase": {
          "type": "string",
          "enum": [
            "army",
            "civic",
            "commerce",
            "event",
            "leadership",
            "region",
            "upkeep"
          ]
        },
        "dcAdjustment": {
          "type": "number"
        },
        "enabled": {
          "type": "boolean"
        },
        "fortune": {
          "type": "boolean"
        },
        "oncePerRound": {
          "type": "boolean"
        },
        "id": {
          "type": "string"
        },
        "hint": {
          "type": "object"
        },
        "criticalSuccess": {
          "$ref": "#/$defs/ActivityResult"
        },
        "success": {
          "$ref": "#/$defs/ActivityResult"
        },
        "failure": {
          "$ref": "#/$defs/ActivityResult"
        },
        "criticalFailure": {
          "$ref": "#/$defs/ActivityResult"
        }
      }
    },
    "Modifier": {
      "type": "object",
      "additionalProperties": false,
      "required": [
        "type",
        "value",
        "name",
        "enabled"
      ],
      "properties": {
        "type": {
          "type": "string",
          "enum": [
            "ability",
            "proficiency",
            "item",
            "status",
            "circumstance",
            "vacancy",
            "untyped",
            "leadership"
          ]
        },
        "value": {
          "type": "number"
        },
        "predicatedValue": {
          "type": "array",
          "items": {
            "$ref": "#/$defs/WhenPredicate"
          }
        },
        "name": {
          "type": "string"
        },
        "enabled": {
          "type": "boolean"
        },
        "turns": {
          "type": "number"
        },
        "isConsumedAfterRoll": {
          "type": "boolean"
        },
        "rollOptions": {
          "type": "array",
          "items": {
            "type": "string"
          }
        },
        "predicates": {
          "type": "array",
          "items": {
            "$ref": "#/$defs/Predicate"
          }
        }
      }
    },
    "Predicate": {
      "oneOf": [
        {
          "$ref": "#/$defs/GtePredicate"
        },
        {
          "$ref": "#/$defs/GtPredicate"
        },
        {
          "$ref": "#/$defs/LtePredicate"
        },
        {
          "$ref": "#/$defs/LtPredicate"
        },
        {
          "$ref": "#/$defs/EqPredicate"
        },
        {
          "$ref": "#/$defs/OrPredicate"
        },
        {
          "$ref": "#/$defs/AndPredicate"
        },
        {
          "$ref": "#/$defs/NotPredicate"
        },
        {
          "$ref": "#/$defs/HasFlagPredicate"
        },
        {
          "$ref": "#/$defs/HasRollOptionPredicate"
        },
        {
          "$ref": "#/$defs/InPredicate"
        }
      ]
    },
    "InPredicate": {
      "type": "object",
      "additionalProperties": false,
      "required": [
        "in"
      ],
      "properties": {
        "in": {
          "type": "array",
          "prefixItems": [
            {
              "type": "string"
            },
            {
              "type": "array",
              "items": {
                "type": "string"
              }
            }
          ],
          "items": false,
          "minItems": 2
        }
      }
    },
    "GtePredicate": {
      "type": "object",
      "additionalProperties": false,
      "required": [
        "gte"
      ],
      "properties": {
        "gte": {
          "type": "array",
          "prefixItems": [
            {
              "type": "string"
            },
            {
              "type": "string"
            }
          ],
          "items": false,
          "minItems": 2
        }
      }
    },
    "GtPredicate": {
      "type": "object",
      "additionalProperties": false,
      "required": [
        "gt"
      ],
      "properties": {
        "gt": {
          "type": "array",
          "prefixItems": [
            {
              "type": "string"
            },
            {
              "type": "string"
            }
          ],
          "items": false,
          "minItems": 2
        }
      }
    },
    "LtePredicate": {
      "type": "object",
      "additionalProperties": false,
      "required": [
        "lte"
      ],
      "properties": {
        "lte": {
          "type": "array",
          "prefixItems": [
            {
              "type": "string"
            },
            {
              "type": "string"
            }
          ],
          "items": false,
          "minItems": 2
        }
      }
    },
    "LtPredicate": {
      "type": "object",
      "additionalProperties": false,
      "required": [
        "lt"
      ],
      "properties": {
        "lt": {
          "type": "array",
          "prefixItems": [
            {
              "type": "string"
            },
            {
              "type": "string"
            }
          ],
          "items": false,
          "minItems": 2
        }
      }
    },
    "EqPredicate": {
      "type": "object",
      "additionalProperties": false,
      "required": [
        "eq"
      ],
      "properties": {
        "eq": {
          "type": "array",
          "prefixItems": [
            {
              "type": "string"
            },
            {
              "type": "string"
            }
          ],
          "items": false,
          "minItems": 2
        }
      }
    },
    "OrPredicate": {
      "type": "object",
      "additionalProperties": false,
      "required": [
        "or"
      ],
      "properties": {
        "or": {
          "type": "array",
          "items": {
            "$ref": "#/$defs/Predicate"
          }
        }
      }
    },
    "AndPredicate": {
      "type": "object",
      "additionalProperties": false,
      "required": [
        "and"
      ],
      "properties": {
        "and": {
          "type": "array",
          "items": {
            "$ref": "#/$defs/Predicate"
          }
        }
      }
    },
    "NotPredicate": {
      "type": "object",
      "additionalProperties": false,
      "required": [
        "not"
      ],
      "properties": {
        "not": {
          "$ref": "#/$defs/Predicate"
        }
      }
    },
    "HasFlagPredicate": {
      "type": "object",
      "additionalProperties": false,
      "required": [
        "hasFlag"
      ],
      "properties": {
        "hasFlag": {
          "type": "string"
        }
      }
    },
    "HasRollOptionPredicate": {
      "type": "object",
      "additionalProperties": false,
      "required": [
        "hasRollOption"
      ],
      "properties": {
        "hasRollOption": {
          "type": "string"
        }
      }
    },
    "KingdomSkill": {
      "type": "string",
      "enum": [
        "agriculture",
        "arts",
        "boating",
        "defense",
        "engineering",
        "exploration",
        "folklore",
        "industry",
        "intrigue",
        "magic",
        "politics",
        "scholarship",
        "statecraft",
        "trade",
        "warfare",
        "wilderness"
      ]
    },
    "WhenPredicate": {
      "type": "object",
      "additionalProperties": false,
      "required": [
        "when"
      ],
      "properties": {
        "when": {
          "type": "array",
          "prefixItems": [
            {
              "$ref": "#/$defs/Predicate"
            },
            {
              "type": "string"
            }
          ],
          "items": false,
          "minItems": 2
        }
      }
    },
    "Skills": {
      "type": "object",
      "additionalProperties": false,
      "properties": {
        "agriculture": {
          "type": "number"
        },
        "arts": {
          "type": "number"
        },
        "boating": {
          "type": "number"
        },
        "defense": {
          "type": "number"
        },
        "engineering": {
          "type": "number"
        },
        "exploration": {
          "type": "number"
        },
        "folklore": {
          "type": "number"
        },
        "industry": {
          "type": "number"
        },
        "intrigue": {
          "type": "number"
        },
        "magic": {
          "type": "number"
        },
        "politics": {
          "type": "number"
        },
        "scholarship": {
          "type": "number"
        },
        "statecraft": {
          "type": "number"
        },
        "trade": {
          "type": "number"
        },
        "warfare": {
          "type": "number"
        },
        "wilderness": {
          "type": "number"
        }
      }
    }
  }
}
