{
    "id": "disband-army",
    "oncePerRound": false,
    "fortune": false,
    "enabled": true,
    "phase": "army",
    "dc": "none",
    "title": "Disband Army",
    "description": "You can choose to disband an army with no check needed. If the army consisted of conscripts from your kingdom, the soldiers revert to being citizens. If the army was recruited from creatures encountered in the wilds, they return to their homes. A disbanded army no longer contributes to your kingdomâ€™s Consumption.",
    "skills": {
        "agriculture": 0,
        "arts": 0,
        "boating": 0,
        "defense": 0,
        "engineering": 0,
        "exploration": 0,
        "folklore": 0,
        "industry": 0,
        "intrigue": 0,
        "magic": 0,
        "politics": 0,
        "scholarship": 0,
        "statecraft": 0,
        "trade": 0,
        "warfare": 0,
        "wilderness": 0
    }
}