{
  "id": "purchase-commodities",
  "oncePerRound": false,
  "fortune": false,
  "enabled": true,
  "phase": "leadership",
  "dc": "control",
  "title": "activities.purchase-commodities.title",
  "description": "activities.purchase-commodities.description",
  "skills": {
    "trade": 0
  },
  "criticalSuccess": {
    "msg": "activities.purchase-commodities.criticalSuccess.msg"
  },
  "success": {
    "msg": "activities.purchase-commodities.success.msg"
  },
  "failure": {
    "msg": "activities.purchase-commodities.failure.msg"
  },
  "criticalFailure": {
    "msg": "activities.purchase-commodities.criticalFailure.msg"
  }
}