{
    "id": "quell-unrest",
    "oncePerRound": true,
    "fortune": false,
    "enabled": true,
    "phase": "leadership",
    "dc": "control",
    "title": "Quell Unrest",
    "description": "You send your agents among the citizenry with the charge of suppressing dissent and calming unrest. You can attempt a basic Arts, Folklore, Intrigue, Magic, Politics, or Warfare check to Quell Unrest, but you can never use the same skill for this activity in consecutive Kingdom turns. This activity cannot be attempted more than once per Kingdom turn.",
    "skills": {
        "arts": 0,
        "folklore": 0,
        "intrigue": 0,
        "magic": 0,
        "politics": 0,
        "warfare": 0
    },
    "criticalSuccess": {
        "msg": "@lose1d6Unrest"
    },
    "success": {
        "msg": "@lose1Unrest"
    },
    "failure": {
        "msg": "You fail to reduce Unrest."
    },
    "criticalFailure": {
        "msg": "You not only fail to reduce Unrest, but actually incite further anger among the citizenry. Choose one of the following: @gain1d4Unrest or increase two Ruins of your choice by 1: <ul><li>@gain1Corruption</li><li>@gain1Crime</li><li>@gain1Decay</li><li>@gain1Strife</li></ul>"
    }
}