{
  "id": "craft-luxuries",
  "oncePerRound": false,
  "fortune": false,
  "enabled": true,
  "phase": "leadership",
  "dc": "control",
  "title": "activities.craft-luxuries.title",
  "description": "activities.craft-luxuries.description",
  "skills": {
    "arts": 0
  },
  "criticalSuccess": {
    "msg": "activities.craft-luxuries.criticalSuccess.msg"
  },
  "success": {
    "msg": "activities.craft-luxuries.success.msg"
  },
  "failure": {
    "msg": "activities.craft-luxuries.failure.msg"
  },
  "criticalFailure": {
    "msg": "activities.craft-luxuries.criticalFailure.msg"
  }
}