{
  "id": "pledge-of-fealty",
  "oncePerRound": false,
  "fortune": false,
  "enabled": true,
  "phase": "leadership",
  "dc": "control",
  "title": "activities.pledge-of-fealty.title",
  "description": "activities.pledge-of-fealty.description",
  "skills": {
    "intrigue": 1,
    "statecraft": 1,
    "warfare": 1
  },
  "criticalSuccess": {
    "msg": "activities.pledge-of-fealty.criticalSuccess.msg"
  },
  "success": {
    "msg": "activities.pledge-of-fealty.success.msg"
  },
  "failure": {
    "msg": "activities.pledge-of-fealty.failure.msg"
  },
  "criticalFailure": {
    "msg": "activities.pledge-of-fealty.criticalFailure.msg"
  }
}