{
  "id": "repair-the-flooded-mine",
  "oncePerRound": false,
  "fortune": false,
  "enabled": false,
  "phase": "leadership",
  "dc": 32,
  "title": "activities.repair-the-flooded-mine.title",
  "description": "activities.repair-the-flooded-mine.description",
  "skills": {
    "engineering": 3
  },
  "criticalSuccess": {
    "msg": "activities.repair-the-flooded-mine.criticalSuccess.msg"
  },
  "success": {
    "msg": "activities.repair-the-flooded-mine.success.msg"
  },
  "failure": {
    "msg": "activities.repair-the-flooded-mine.failure.msg"
  },
  "criticalFailure": {
    "msg": "activities.repair-the-flooded-mine.criticalFailure.msg"
  }
}