{
  "id": "show-of-force",
  "oncePerRound": false,
  "fortune": false,
  "enabled": false,
  "phase": "leadership",
  "dc": "control",
  "title": "activities.show-of-force.title",
  "description": "activities.show-of-force.description",
  "skills": {
    "warfare": 0
  },
  "criticalSuccess": {
    "msg": "activities.show-of-force.criticalSuccess.msg"
  },
  "success": {
    "msg": "activities.show-of-force.success.msg"
  },
  "failure": {
    "msg": "activities.show-of-force.failure.msg"
  },
  "criticalFailure": {
    "msg": "activities.show-of-force.criticalFailure.msg"
  }
}