{
  "id": "harvest-lily-pollen",
  "oncePerRound": false,
  "fortune": false,
  "enabled": false,
  "phase": "region",
  "dc": "control",
  "title": "activities.harvest-lily-pollen.title",
  "description": "activities.harvest-lily-pollen.description",
  "skills": {
    "agriculture": 3
  },
  "criticalSuccess": {
    "msg": "activities.harvest-lily-pollen.criticalSuccess.msg"
  },
  "success": {
    "msg": "activities.harvest-lily-pollen.success.msg"
  },
  "failure": {
    "msg": "activities.harvest-lily-pollen.failure.msg"
  },
  "criticalFailure": {
    "msg": "activities.harvest-lily-pollen.criticalFailure.msg"
  }
}