{
  "id": "recover-army-lost",
  "oncePerRound": false,
  "fortune": false,
  "enabled": true,
  "phase": "army",
  "dc": "control",
  "title": "activities.recover-army-lost.title",
  "description": "activities.recover-army-lost.description",
  "skills": {
    "exploration": 0,
    "wilderness": 2
  },
  "criticalSuccess": {
    "msg": "activities.recover-army-lost.criticalSuccess.msg"
  },
  "success": {
    "msg": "activities.recover-army-lost.success.msg"
  },
  "failure": {
    "msg": "activities.recover-army-lost.failure.msg"
  },
  "criticalFailure": {
    "msg": "activities.recover-army-lost.criticalFailure.msg"
  }
}