{
  "id": "outfit-army",
  "oncePerRound": false,
  "fortune": false,
  "enabled": true,
  "phase": "army",
  "dc": "control",
  "title": "activities.outfit-army.title",
  "description": "activities.outfit-army.description",
  "skills": {
    "trade": 0,
    "warfare": 0
  },
  "criticalSuccess": {
    "msg": "activities.outfit-army.criticalSuccess.msg"
  },
  "success": {
    "msg": "activities.outfit-army.success.msg"
  },
  "failure": {
    "msg": "activities.outfit-army.failure.msg"
  },
  "criticalFailure": {
    "msg": "activities.outfit-army.criticalFailure.msg"
  }
}