{
    "id": "build-roads",
    "title": "Build Roads",
    "oncePerRound": false,
    "fortune": false,
    "enabled": true,
    "phase": "region",
    "dc": "control",
    "description": "<p>You order your kingdom’s engineers to construct a network of robust roads through the hex. Travel along roads uses a terrain type one step better than the surrounding terrain; for example, roads through forest hexes—normally difficult terrain—allow travel as if it were open terrain.</p>\n<p>Spend RP as determined by the hex’s most inhospitable terrain (if the hex includes any rivers that cross the hex from one hex side to any other, you must spend double the normal RP cost to also build bridges; this adds the Bridge structure to that hex):</p>\n<ul>\n<li><b>Mountains</b>: <button type=\"button\" class=\"km-gain-lose\" data-type=\"resource-points\" data-mode=\"lose\" data-turn=\"now\" data-multiple=\"false\" data-value=\"12\">Lose 12 Resource Points</button></li>\n<li><b>Swamps</b>: <button type=\"button\" class=\"km-gain-lose\" data-type=\"resource-points\" data-mode=\"lose\" data-turn=\"now\" data-multiple=\"false\" data-value=\"8\">Lose 8 Resource Points</button></li>\n<li><b>Forests</b>: <button type=\"button\" class=\"km-gain-lose\" data-type=\"resource-points\" data-mode=\"lose\" data-turn=\"now\" data-multiple=\"false\" data-value=\"4\">Lose 4 Resource Points</button></li>\n<li><b>Hills</b>: <button type=\"button\" class=\"km-gain-lose\" data-type=\"resource-points\" data-mode=\"lose\" data-turn=\"now\" data-multiple=\"false\" data-value=\"2\">Lose 2 Resource Points</button></li>\n<li><b>Plains</b>: <button type=\"button\" class=\"km-gain-lose\" data-type=\"resource-points\" data-mode=\"lose\" data-turn=\"now\" data-multiple=\"false\" data-value=\"1\">Lose 1 Resource Points</button></li>\n</ul>\n<p>Then attempt a basic check. Work with the GM to determine where your roads appear on the map.</p>",
    "requirement": "The hex in which you seek to build roads must be claimed by your kingdom.",
    "skills": {
        "engineering": 0
    },
    "criticalSuccess": {
        "msg": "You build roads into the target hex and, if possible, one adjacent claimed hex that doesn’t yet have roads and whose terrain features are at least as hospitable as those of the target hex"
    },
    "success": {
        "msg": "You build roads in the hex."
    },
    "failure": {
        "msg": "You fail to build roads in the hex."
    },
    "criticalFailure": {
        "msg": "Your attempt to build roads ends in disaster. Not only do you fail to build roads, but you lose several workers to an accident, banditry, a vicious monster, or some other unforeseen occurrence. <button type=\"button\" class=\"km-gain-lose\" data-type=\"unrest\" data-mode=\"gain\" data-turn=\"now\" data-multiple=\"false\" data-value=\"1\">Gain 1 Unrest</button>"
    }
}